"DESCRIPTION","DURATION IN MS","NAME","PARENT SUITE","START TIME","STATUS","STOP TIME","SUB SUITE","SUITE","TEST CLASS","TEST METHOD"
"","17409","Create a ticket for the Owner role","chrome","Sun Mar 02 00:29:56 UTC 2025","failed","Sun Mar 02 00:30:14 UTC 2025","Create tickets","create-tickets.feature.spec.js","",""
"","17071","Add an existing customer to a new ticket and pay with Loyalty points","chrome","Sun Mar 02 00:29:55 UTC 2025","failed","Sun Mar 02 00:30:12 UTC 2025","Create tickets","create-tickets.feature.spec.js","",""
"","16680","Create a ticket, add Tip and pay with Credit card","chrome","Sun Mar 02 00:29:53 UTC 2025","failed","Sun Mar 02 00:30:10 UTC 2025","Create tickets","create-tickets.feature.spec.js","",""
"","12106","Create a ticket and pay with Zelle type","chrome","Sun Mar 02 00:30:30 UTC 2025","passed","Sun Mar 02 00:30:42 UTC 2025","Create tickets","create-tickets.feature.spec.js","",""
"","27335","Split tip on ticket after paying by Credit card","chrome","Sun Mar 02 00:31:20 UTC 2025","failed","Sun Mar 02 00:31:48 UTC 2025","Create tickets","create-tickets.feature.spec.js","",""
"","17066","Create a new customer on the fly","chrome","Sun Mar 02 00:29:55 UTC 2025","failed","Sun Mar 02 00:30:12 UTC 2025","Create tickets","create-tickets.feature.spec.js","",""
"","16518","Create a ticket and pay with Gift Card type","chrome","Sun Mar 02 00:29:54 UTC 2025","failed","Sun Mar 02 00:30:11 UTC 2025","Create tickets","create-tickets.feature.spec.js","",""
"","16871","Create a ticket with multiple technicians","chrome","Sun Mar 02 00:29:53 UTC 2025","failed","Sun Mar 02 00:30:10 UTC 2025","Create tickets","create-tickets.feature.spec.js","",""
"","4118","Authentication: Admin role","setup","Sun Mar 02 00:30:24 UTC 2025","passed","Sun Mar 02 00:30:29 UTC 2025","","../../src/auth.setup.ts","",""
