"DESCRIPTION","DURATION IN MS","NAME","PARENT SUITE","START TIME","STATUS","STOP TIME","SUB SUITE","SUITE","TEST CLASS","TEST METHOD"
"","4723","Authentication: Admin role","setup","Thu Mar 13 12:54:02 UTC 2025","passed","Thu Mar 13 12:54:07 UTC 2025","","../../src/auth.setup.ts","",""
"","31687","Split tip on ticket after paying by Credit card","chrome","Thu Mar 13 12:55:32 UTC 2025","failed","Thu Mar 13 12:56:04 UTC 2025","Create tickets","create-tickets.feature.spec.js","",""
"","21543","Create a ticket and pay with Gift Card type","chrome","Thu Mar 13 12:52:21 UTC 2025","passed","Thu Mar 13 12:52:43 UTC 2025","Create tickets","create-tickets.feature.spec.js","",""
"","29485","Create a new customer on the fly","chrome","Thu Mar 13 12:52:01 UTC 2025","passed","Thu Mar 13 12:52:31 UTC 2025","Create tickets","create-tickets.feature.spec.js","",""
"","21894","Create a ticket, add Tip and pay with Credit card","chrome","Thu Mar 13 12:52:21 UTC 2025","passed","Thu Mar 13 12:52:43 UTC 2025","Create tickets","create-tickets.feature.spec.js","",""
"","34600","Create a ticket with multiple technicians","chrome","Thu Mar 13 12:53:17 UTC 2025","failed","Thu Mar 13 12:53:52 UTC 2025","Create tickets","create-tickets.feature.spec.js","",""
"","27200","Create a ticket and pay with Zelle type","chrome","Thu Mar 13 12:54:08 UTC 2025","passed","Thu Mar 13 12:54:35 UTC 2025","Create tickets","create-tickets.feature.spec.js","",""
"","28437","Add an existing customer to a new ticket and pay with Loyalty points","chrome","Thu Mar 13 12:54:08 UTC 2025","passed","Thu Mar 13 12:54:37 UTC 2025","Create tickets","create-tickets.feature.spec.js","",""
"","27236","Create a ticket for the Owner role","chrome","Thu Mar 13 12:54:08 UTC 2025","passed","Thu Mar 13 12:54:35 UTC 2025","Create tickets","create-tickets.feature.spec.js","",""
