"DESCRIPTION","DURATION IN MS","NAME","PARENT SUITE","START TIME","STATUS","STOP TIME","SUB SUITE","SUITE","TEST CLASS","TEST METHOD"
"","25244","Add an existing customer to a new ticket and pay with Loyalty points","chrome","Thu Mar 13 15:52:17 UTC 2025","passed","Thu Mar 13 15:52:42 UTC 2025","Create tickets","create-tickets.feature.spec.js","",""
"","5273","Authentication: Admin role","setup","Thu Mar 13 15:52:10 UTC 2025","passed","Thu Mar 13 15:52:16 UTC 2025","","../../src/auth.setup.ts","",""
"","27569","Create a ticket with multiple technicians","chrome","Thu Mar 13 15:52:13 UTC 2025","passed","Thu Mar 13 15:52:41 UTC 2025","Create tickets","create-tickets.feature.spec.js","",""
"","30160","Create a ticket and pay with Gift Card type","chrome","Thu Mar 13 15:52:00 UTC 2025","passed","Thu Mar 13 15:52:30 UTC 2025","Create tickets","create-tickets.feature.spec.js","",""
"","29338","Create a new customer on the fly","chrome","Thu Mar 13 15:52:13 UTC 2025","passed","Thu Mar 13 15:52:43 UTC 2025","Create tickets","create-tickets.feature.spec.js","",""
"","30231","Create a ticket, add Tip and pay with Credit card","chrome","Thu Mar 13 15:52:00 UTC 2025","passed","Thu Mar 13 15:52:30 UTC 2025","Create tickets","create-tickets.feature.spec.js","",""
"","26851","Split tip on ticket after paying by Credit card","chrome","Thu Mar 13 15:51:44 UTC 2025","passed","Thu Mar 13 15:52:10 UTC 2025","Create tickets","create-tickets.feature.spec.js","",""
"","24483","Create a ticket for the Owner role","chrome","Thu Mar 13 15:52:17 UTC 2025","passed","Thu Mar 13 15:52:41 UTC 2025","Create tickets","create-tickets.feature.spec.js","",""
"","24481","Create a ticket and pay with Zelle type","chrome","Thu Mar 13 15:51:44 UTC 2025","passed","Thu Mar 13 15:52:08 UTC 2025","Create tickets","create-tickets.feature.spec.js","",""
