"DESCRIPTION","DURATION IN MS","NAME","PARENT SUITE","START TIME","STATUS","STOP TIME","SUB SUITE","SUITE","TEST CLASS","TEST METHOD"
"","17198","Create a ticket, add Tip and pay with Credit card","chrome","Thu Feb 27 23:46:38 UTC 2025","passed","Thu Feb 27 23:46:56 UTC 2025","Create tickets","create-tickets.feature.spec.js","",""
"","0","Add an existing customer to a new ticket and pay with Loyalty points","chrome","Thu Feb 27 23:46:50 UTC 2025","skipped","Thu Feb 27 23:46:50 UTC 2025","Create tickets","create-tickets.feature.spec.js","",""
"","0","Create a new customer on the fly","chrome","Thu Feb 27 23:46:50 UTC 2025","skipped","Thu Feb 27 23:46:50 UTC 2025","Create tickets","create-tickets.feature.spec.js","",""
"","31007","Create a ticket with multiple technicians","chrome","Thu Feb 27 23:46:25 UTC 2025","passed","Thu Feb 27 23:46:56 UTC 2025","Create tickets","create-tickets.feature.spec.js","",""
"","17176","Create a ticket and pay with Gift Card type","chrome","Thu Feb 27 23:46:38 UTC 2025","passed","Thu Feb 27 23:46:55 UTC 2025","Create tickets","create-tickets.feature.spec.js","",""
"","12930","Create a ticket and pay with Zelle type","chrome","Thu Feb 27 23:46:42 UTC 2025","passed","Thu Feb 27 23:46:55 UTC 2025","Create tickets","create-tickets.feature.spec.js","",""
"","4387","Authentication: Admin role","setup","Thu Feb 27 23:46:45 UTC 2025","passed","Thu Feb 27 23:46:50 UTC 2025","","../../src/auth.setup.ts","",""
"","1","Split tip on ticket after paying by Credit card","chrome","Thu Feb 27 23:46:41 UTC 2025","skipped","Thu Feb 27 23:46:41 UTC 2025","Create tickets","create-tickets.feature.spec.js","",""
"","90063","Create a ticket for the Owner role","chrome","Thu Feb 27 23:49:54 UTC 2025","broken","Thu Feb 27 23:51:24 UTC 2025","Create tickets","create-tickets.feature.spec.js","",""
